{
  "$schema": "https://json-schema.org/draft/2020-12/schema",
  "$id": "https://vectoplan.local/contracts/structural-analysis-job/0.2",
  "title": "VECTOPLAN structural analysis job",
  "type": "object",
  "required": ["contract_version", "project_ref", "model_revision_ref", "job_ref", "structure_type", "standards_profile", "load_cases", "analysis_model"],
  "properties": {
    "contract_version": {"const": "structural-analysis-job/0.2"},
    "project_ref": {"type": "string", "minLength": 1},
    "model_revision_ref": {"type": "string", "minLength": 1},
    "job_ref": {"type": "string", "minLength": 1},
    "structure_type": {"enum": ["residential_building", "single_family_house", "multi_family_building", "high_rise_building", "office_building", "school_building", "hospital_building", "church_building", "assembly_building", "hotel_building", "retail_building", "parking_structure", "sports_building", "warehouse", "building_special", "industrial_hall", "bridge", "scaffold_standing", "scaffold_suspended", "falsework", "scaffold_special", "tower", "retaining_structure", "generic"]},
    "material_kind": {"enum": ["reinforced_concrete", "prestressed_concrete", "steel", "composite", "timber", "masonry", "aluminium", "soil"]},
    "standards_profile": {"type": "string", "minLength": 1},
    "load_cases": {
      "type": "array",
      "minItems": 1,
      "items": {
        "type": "object",
        "required": ["load_case_id", "label", "category", "value", "unit"],
        "properties": {
          "load_case_id": {"type": "string", "minLength": 1},
          "label": {"type": "string"},
          "category": {"enum": ["permanent", "variable", "accidental"]},
          "value": {"type": "number"},
          "unit": {"type": "string"},
          "action_type": {"type": "string"},
          "psi0": {"type": "number"},
          "psi1": {"type": "number"},
          "psi2": {"type": "number"}
        },
        "additionalProperties": false
      }
    },
    "analysis_model": {
      "type": "object",
      "required": ["kind"],
      "properties": {"kind": {"enum": ["beam_line", "surface_plate", "member_check"]}},
      "additionalProperties": true
    },
    "design": {
      "type": "object",
      "required": ["type", "parameters"],
      "properties": {"type": {"type": "string"}, "parameters": {"type": "object"}},
      "additionalProperties": false
    }
  },
  "additionalProperties": false
}
