{
  "contract_version": "structural-analysis-job/0.2",
  "project_ref": "reference_residential_plate",
  "model_revision_ref": "reference_001",
  "job_ref": "job_residential_plate",
  "structure_type": "residential_building",
  "material_kind": "reinforced_concrete",
  "standards_profile": "DE_EC_2021",
  "load_cases": [
    {"load_case_id": "G", "label": "Eigengewicht und Ausbau", "category": "permanent", "value": 6.5, "unit": "kN/m²", "action_type": "self_weight"},
    {"load_case_id": "Q", "label": "Nutzlast Wohnen", "category": "variable", "value": 2.0, "unit": "kN/m²", "action_type": "imposed"}
  ],
  "analysis_model": {
    "kind": "surface_plate",
    "length_x_m": 5.2,
    "length_y_m": 4.2,
    "thickness_m": 0.20,
    "elastic_modulus_mpa": 31000.0,
    "poisson_ratio": 0.2,
    "load_case_values_kn_m2": {"G": 6.5, "Q": 2.0},
    "series_terms": 17,
    "grid_size": 25
  },
  "design": {
    "type": "reinforced_concrete",
    "parameters": {"concrete_class": "C25/30", "reinforcement_class": "B500B", "width_mm": 1000.0, "height_mm": 200.0, "cover_mm": 30.0, "bar_diameter_mm": 10.0, "provided_reinforcement_mm2": 754.0}
  }
}
