{
  "contract_version": "structural-analysis-job/0.2",
  "project_ref": "reference_masonry_wall",
  "model_revision_ref": "reference_001",
  "job_ref": "job_masonry_wall",
  "structure_type": "residential_building",
  "material_kind": "masonry",
  "standards_profile": "DE_EC_2021",
  "load_cases": [{"load_case_id": "GQ", "label": "Bemessungslast", "category": "permanent", "value": 1.0, "unit": "-", "action_type": "self_weight"}],
  "analysis_model": {"kind": "member_check"},
  "design": {
    "type": "masonry",
    "parameters": {"masonry_grade": "MZ12_NMIIA", "length_m": 4.5, "thickness_m": 0.24, "height_m": 2.85, "design_axial_kn": 740.0, "design_moment_knm": 14.0}
  }
}
