{
  "contract_version": "structural-analysis-job/0.2",
  "project_ref": "reference_single_span_rc",
  "model_revision_ref": "reference_001",
  "job_ref": "job_single_span_rc",
  "structure_type": "residential_building",
  "material_kind": "reinforced_concrete",
  "standards_profile": "DE_EC_2021",
  "load_cases": [
    {"load_case_id": "G", "label": "Ständige Last", "category": "permanent", "value": 12.0, "unit": "kN/m", "action_type": "self_weight"},
    {"load_case_id": "Q", "label": "Nutzlast", "category": "variable", "value": 8.0, "unit": "kN/m", "action_type": "imposed"}
  ],
  "analysis_model": {
    "kind": "beam_line",
    "spans": [{"span_id": "S1", "length_m": 6.0, "elastic_modulus_mpa": 33000.0, "inertia_m4": 0.003125, "load_case_values_kn_m": {"G": 12.0, "Q": 8.0}}],
    "supports": [{"vertical": true, "rotation": false}, {"vertical": true, "rotation": false}],
    "samples_per_span": 41
  },
  "design": {
    "type": "reinforced_concrete",
    "parameters": {"concrete_class": "C30/37", "reinforcement_class": "B500B", "width_mm": 300.0, "height_mm": 500.0, "cover_mm": 35.0, "bar_diameter_mm": 16.0, "provided_reinforcement_mm2": 1963.0}
  }
}
