{
  "contract_version": "structural-analysis-job/0.2",
  "project_ref": "reference_bridge_abutment",
  "model_revision_ref": "reference_001",
  "job_ref": "job_bridge_abutment",
  "structure_type": "retaining_structure",
  "material_kind": "soil",
  "standards_profile": "DE_EC_2021",
  "load_cases": [
    {"load_case_id": "G_E", "label": "Bodeneigengewicht", "category": "permanent", "value": 11.0, "unit": "kN/m³", "action_type": "self_weight"},
    {"load_case_id": "Q", "label": "Verkehrsauflast", "category": "variable", "value": 10.0, "unit": "kN/m²", "action_type": "traffic"}
  ],
  "analysis_model": {"kind": "member_check"},
  "design": {
    "type": "retaining_wall",
    "parameters": {
      "height_m": 6.25,
      "soil_unit_weight_kn_m3": 11.0,
      "friction_angle_deg": 32.0,
      "surcharge_kn_m2": 10.0,
      "water_depth_m": 4.30,
      "water_unit_weight_kn_m3": 10.0,
      "design_horizontal_resistance_kn_m": 280.0
    }
  }
}
