{
  "contract_version": "structural-analysis-job/0.2",
  "project_ref": "reference_two_span_steel",
  "model_revision_ref": "reference_001",
  "job_ref": "job_two_span_steel",
  "structure_type": "generic",
  "material_kind": "steel",
  "standards_profile": "DE_EC_2021",
  "load_cases": [
    {"load_case_id": "G", "label": "Eigengewicht und Ausbau", "category": "permanent", "value": 7.5, "unit": "kN/m", "action_type": "self_weight"},
    {"load_case_id": "Q", "label": "Nutzlast", "category": "variable", "value": 10.0, "unit": "kN/m", "action_type": "imposed"}
  ],
  "analysis_model": {
    "kind": "beam_line",
    "spans": [
      {"span_id": "S1", "length_m": 5.5, "elastic_modulus_mpa": 210000.0, "inertia_m4": 0.0008356, "load_case_values_kn_m": {"G": 7.5, "Q": 10.0}},
      {"span_id": "S2", "length_m": 7.0, "elastic_modulus_mpa": 210000.0, "inertia_m4": 0.0008356, "load_case_values_kn_m": {"G": 7.5, "Q": 10.0}}
    ],
    "supports": [{"vertical": true}, {"vertical": true}, {"vertical": true}],
    "samples_per_span": 51
  },
  "design": {
    "type": "steel",
    "parameters": {"steel_grade": "S355", "area_mm2": 14910.0, "shear_area_mm2": 6650.0, "section_modulus_cm3": 3070.0, "design_axial_kn": 0.0}
  }
}
